  1 0.000000000   10.0.0.253 -> 10.0.0.251   TCP 460 48178→54310 [PSH, ACK] Seq=1 Ack=1 Win=62 Len=394 TSval=1501436 TSecr=1500686
  2 0.000606000   10.0.0.251 -> 10.0.0.253   TCP 107 54310→48178 [PSH, ACK] Seq=1 Ack=395 Win=363 Len=41 TSval=1501436 TSecr=1501436
  3 0.000635000   10.0.0.253 -> 10.0.0.251   TCP 66 48178→54310 [ACK] Seq=395 Ack=42 Win=62 Len=0 TSval=1501436 TSecr=1501436
  4 0.021131000   10.0.0.254 -> 10.0.0.251   TCP 460 50770→54310 [PSH, ACK] Seq=1 Ack=1 Win=62 Len=394 TSval=1501441 TSecr=1500691
  5 0.021642000   10.0.0.251 -> 10.0.0.254   TCP 107 54310→50770 [PSH, ACK] Seq=1 Ack=395 Win=363 Len=41 TSval=1501441 TSecr=1501441
  6 0.021671000   10.0.0.254 -> 10.0.0.251   TCP 66 50770→54310 [ACK] Seq=395 Ack=42 Win=62 Len=0 TSval=1501441 TSecr=1501441
  7 0.027829000   10.0.0.252 -> 10.0.0.251   TCP 460 43210→54310 [PSH, ACK] Seq=1 Ack=1 Win=62 Len=394 TSval=1501443 TSecr=1500693
  8 0.028133000   10.0.0.251 -> 10.0.0.252   TCP 107 54310→43210 [PSH, ACK] Seq=1 Ack=395 Win=363 Len=41 TSval=1501443 TSecr=1501443
  9 0.028156000   10.0.0.252 -> 10.0.0.251   TCP 66 43210→54310 [ACK] Seq=395 Ack=42 Win=62 Len=0 TSval=1501443 TSecr=1501443
 10 1.576904000   10.0.0.251 -> 10.0.0.254   TCP 74 36184→50010 [SYN] Seq=0 Win=29200 Len=0 MSS=1460 SACK_PERM=1 TSval=1501830 TSecr=0 WS=512
 11 1.585291000   10.0.0.254 -> 10.0.0.251   TCP 74 50010→36184 [SYN, ACK] Seq=0 Ack=1 Win=28960 Len=0 MSS=1460 SACK_PERM=1 TSval=1501831 TSecr=1501830 WS=512
 12 1.585320000   10.0.0.251 -> 10.0.0.254   TCP 66 36184→50010 [ACK] Seq=1 Ack=1 Win=29696 Len=0 TSval=1501832 TSecr=1501831
 13 1.585870000   10.0.0.251 -> 10.0.0.254   TCP 247 36184→50010 [PSH, ACK] Seq=1 Ack=1 Win=29696 Len=181 TSval=1501832 TSecr=1501831
 14 1.595396000   10.0.0.254 -> 10.0.0.251   TCP 66 50010→36184 [ACK] Seq=1 Ack=182 Win=30208 Len=0 TSval=1501835 TSecr=1501832
 15 1.715162000   10.0.0.254 -> 10.0.0.251   TCP 71 50010→36184 [PSH, ACK] Seq=1 Ack=182 Win=30208 Len=5 TSval=1501865 TSecr=1501832
 16 1.715174000   10.0.0.251 -> 10.0.0.254   TCP 66 36184→50010 [ACK] Seq=182 Ack=6 Win=29696 Len=0 TSval=1501865 TSecr=1501865
 17 1.728197000   10.0.0.251 -> 10.0.0.254   TCP 2962 36184→50010 [ACK] Seq=182 Ack=6 Win=29696 Len=2896 TSval=1501868 TSecr=1501865
 18 1.728230000   10.0.0.254 -> 10.0.0.251   TCP 66 50010→36184 [ACK] Seq=6 Ack=3078 Win=35840 Len=0 TSval=1501868 TSecr=1501868
 19 1.728235000   10.0.0.251 -> 10.0.0.254   TCP 2962 36184→50010 [ACK] Seq=3078 Ack=6 Win=29696 Len=2896 TSval=1501868 TSecr=1501865
 20 1.728241000   10.0.0.254 -> 10.0.0.251   TCP 66 50010→36184 [ACK] Seq=6 Ack=5974 Win=41984 Len=0 TSval=1501868 TSecr=1501868
 21 1.728247000   10.0.0.251 -> 10.0.0.254   TCP 2962 36184→50010 [ACK] Seq=5974 Ack=6 Win=29696 Len=2896 TSval=1501868 TSecr=1501865
 22 1.728255000   10.0.0.254 -> 10.0.0.251   TCP 66 50010→36184 [ACK] Seq=6 Ack=8870 Win=47616 Len=0 TSval=1501868 TSecr=1501868
 23 1.728259000   10.0.0.251 -> 10.0.0.254   TCP 2962 36184→50010 [ACK] Seq=8870 Ack=6 Win=29696 Len=2896 TSval=1501868 TSecr=1501865
 24 1.728263000   10.0.0.254 -> 10.0.0.251   TCP 66 50010→36184 [ACK] Seq=6 Ack=11766 Win=53248 Len=0 TSval=1501868 TSecr=1501868
 25 1.728265000   10.0.0.251 -> 10.0.0.254   TCP 2962 36184→50010 [ACK] Seq=11766 Ack=6 Win=29696 Len=2896 TSval=1501868 TSecr=1501865
 26 1.728269000   10.0.0.254 -> 10.0.0.251   TCP 66 50010→36184 [ACK] Seq=6 Ack=14662 Win=59392 Len=0 TSval=1501868 TSecr=1501868
 27 1.728278000   10.0.0.251 -> 10.0.0.254   TCP 4410 36184→50010 [ACK] Seq=14662 Ack=6 Win=29696 Len=4344 TSval=1501868 TSecr=1501868
 28 1.728281000   10.0.0.251 -> 10.0.0.254   TCP 1514 36184→50010 [ACK] Seq=19006 Ack=6 Win=29696 Len=1448 TSval=1501868 TSecr=1501868
 29 1.728283000   10.0.0.251 -> 10.0.0.254   TCP 5858 36184→50010 [ACK] Seq=20454 Ack=6 Win=29696 Len=5792 TSval=1501868 TSecr=1501868
 30 1.728286000   10.0.0.251 -> 10.0.0.254   TCP 2962 36184→50010 [PSH, ACK] Seq=26246 Ack=6 Win=29696 Len=2896 TSval=1501868 TSecr=1501868
 31 1.728288000   10.0.0.251 -> 10.0.0.254   TCP 2962 36184→50010 [ACK] Seq=29142 Ack=6 Win=29696 Len=2896 TSval=1501868 TSecr=1501868
 32 1.728290000   10.0.0.251 -> 10.0.0.254   TCP 5858 36184→50010 [ACK] Seq=32038 Ack=6 Win=29696 Len=5792 TSval=1501868 TSecr=1501868
 33 1.728293000   10.0.0.251 -> 10.0.0.254   TCP 5858 36184→50010 [PSH, ACK] Seq=37830 Ack=6 Win=29696 Len=5792 TSval=1501868 TSecr=1501868
 34 1.728316000   10.0.0.254 -> 10.0.0.251   TCP 66 50010→36184 [ACK] Seq=6 Ack=19006 Win=68096 Len=0 TSval=1501868 TSecr=1501868
 35 1.728320000   10.0.0.251 -> 10.0.0.254   TCP 7318 36184→50010 [PSH, ACK] Seq=43622 Ack=6 Win=29696 Len=7252 TSval=1501868 TSecr=1501868
 36 1.728316000   10.0.0.254 -> 10.0.0.251   TCP 66 50010→36184 [ACK] Seq=6 Ack=20454 Win=70656 Len=0 TSval=1501868 TSecr=1501868
 37 1.728316000   10.0.0.254 -> 10.0.0.251   TCP 66 50010→36184 [ACK] Seq=6 Ack=26246 Win=82432 Len=0 TSval=1501868 TSecr=1501868
 38 1.728316000   10.0.0.254 -> 10.0.0.251   TCP 66 50010→36184 [ACK] Seq=6 Ack=29142 Win=88064 Len=0 TSval=1501868 TSecr=1501868
 39 1.728317000   10.0.0.254 -> 10.0.0.251   TCP 66 50010→36184 [ACK] Seq=6 Ack=32038 Win=94208 Len=0 TSval=1501868 TSecr=1501868
 40 1.728317000   10.0.0.254 -> 10.0.0.251   TCP 66 50010→36184 [ACK] Seq=6 Ack=37830 Win=105472 Len=0 TSval=1501868 TSecr=1501868
 41 1.728317000   10.0.0.254 -> 10.0.0.251   TCP 66 50010→36184 [ACK] Seq=6 Ack=43622 Win=117248 Len=0 TSval=1501868 TSecr=1501868
 42 1.728331000   10.0.0.254 -> 10.0.0.251   TCP 66 50010→36184 [ACK] Seq=6 Ack=50874 Win=131584 Len=0 TSval=1501868 TSecr=1501868
 43 1.743172000   10.0.0.254 -> 10.0.0.251   TCP 76 50010→36184 [PSH, ACK] Seq=6 Ack=50874 Win=131584 Len=10 TSval=1501872 TSecr=1501868
 44 1.746065000   10.0.0.251 -> 10.0.0.254   TCP 97 36184→50010 [PSH, ACK] Seq=50874 Ack=16 Win=29696 Len=31 TSval=1501872 TSecr=1501872
 45 1.763196000   10.0.0.254 -> 10.0.0.251   TCP 76 50010→36184 [PSH, ACK] Seq=16 Ack=50905 Win=131584 Len=10 TSval=1501877 TSecr=1501872
 46 1.767159000   10.0.0.254 -> 10.0.0.251   TCP 66 50010→36184 [FIN, ACK] Seq=26 Ack=50905 Win=131584 Len=0 TSval=1501878 TSecr=1501872
 47 1.768702000   10.0.0.251 -> 10.0.0.254   TCP 66 36184→50010 [FIN, ACK] Seq=50905 Ack=27 Win=29696 Len=0 TSval=1501878 TSecr=1501877
 48 1.768728000   10.0.0.254 -> 10.0.0.251   TCP 66 50010→36184 [ACK] Seq=27 Ack=50906 Win=131584 Len=0 TSval=1501878 TSecr=1501878
 49 1.772072000   10.0.0.254 -> 10.0.0.251   TCP 491 50770→54310 [PSH, ACK] Seq=395 Ack=42 Win=62 Len=425 TSval=1501879 TSecr=1501441
 50 1.774465000   10.0.0.251 -> 10.0.0.254   TCP 99 54310→50770 [PSH, ACK] Seq=42 Ack=820 Win=363 Len=33 TSval=1501879 TSecr=1501879
 51 1.774489000   10.0.0.254 -> 10.0.0.251   TCP 66 50770→54310 [ACK] Seq=820 Ack=75 Win=62 Len=0 TSval=1501879 TSecr=1501879
 52 3.000610000   10.0.0.253 -> 10.0.0.251   TCP 460 48178→54310 [PSH, ACK] Seq=395 Ack=42 Win=62 Len=394 TSval=1502186 TSecr=1501436
 53 3.000997000   10.0.0.251 -> 10.0.0.253   TCP 107 54310→48178 [PSH, ACK] Seq=42 Ack=789 Win=363 Len=41 TSval=1502186 TSecr=1502186
 54 3.001025000   10.0.0.253 -> 10.0.0.251   TCP 66 48178→54310 [ACK] Seq=789 Ack=83 Win=62 Len=0 TSval=1502186 TSecr=1502186
 55 3.020885000   10.0.0.254 -> 10.0.0.251   TCP 460 50770→54310 [PSH, ACK] Seq=820 Ack=75 Win=62 Len=394 TSval=1502191 TSecr=1501879
 56 3.021101000   10.0.0.251 -> 10.0.0.254   TCP 107 54310→50770 [PSH, ACK] Seq=75 Ack=1214 Win=363 Len=41 TSval=1502191 TSecr=1502191
 57 3.021128000   10.0.0.254 -> 10.0.0.251   TCP 66 50770→54310 [ACK] Seq=1214 Ack=116 Win=62 Len=0 TSval=1502191 TSecr=1502191
 58 3.028450000   10.0.0.252 -> 10.0.0.251   TCP 460 43210→54310 [PSH, ACK] Seq=395 Ack=42 Win=62 Len=394 TSval=1502193 TSecr=1501443
 59 3.028675000   10.0.0.251 -> 10.0.0.252   TCP 107 54310→43210 [PSH, ACK] Seq=42 Ack=789 Win=363 Len=41 TSval=1502193 TSecr=1502193
 60 3.028697000   10.0.0.252 -> 10.0.0.251   TCP 66 43210→54310 [ACK] Seq=789 Ack=83 Win=62 Len=0 TSval=1502193 TSecr=1502193
 61 6.000259000   10.0.0.253 -> 10.0.0.251   TCP 460 48178→54310 [PSH, ACK] Seq=789 Ack=83 Win=62 Len=394 TSval=1502936 TSecr=1502186
 62 6.000638000   10.0.0.251 -> 10.0.0.253   TCP 107 54310→48178 [PSH, ACK] Seq=83 Ack=1183 Win=363 Len=41 TSval=1502936 TSecr=1502936
 63 6.000663000   10.0.0.253 -> 10.0.0.251   TCP 66 48178→54310 [ACK] Seq=1183 Ack=124 Win=62 Len=0 TSval=1502936 TSecr=1502936
 64 6.021571000   10.0.0.254 -> 10.0.0.251   TCP 460 50770→54310 [PSH, ACK] Seq=1214 Ack=116 Win=62 Len=394 TSval=1502941 TSecr=1502191
 65 6.021858000   10.0.0.251 -> 10.0.0.254   TCP 107 54310→50770 [PSH, ACK] Seq=116 Ack=1608 Win=363 Len=41 TSval=1502941 TSecr=1502941
 66 6.021883000   10.0.0.254 -> 10.0.0.251   TCP 66 50770→54310 [ACK] Seq=1608 Ack=157 Win=62 Len=0 TSval=1502941 TSecr=1502941
 67 6.029013000   10.0.0.252 -> 10.0.0.251   TCP 460 43210→54310 [PSH, ACK] Seq=789 Ack=83 Win=62 Len=394 TSval=1502943 TSecr=1502193
 68 6.029225000   10.0.0.251 -> 10.0.0.252   TCP 107 54310→43210 [PSH, ACK] Seq=83 Ack=1183 Win=363 Len=41 TSval=1502943 TSecr=1502943
 69 6.029252000   10.0.0.252 -> 10.0.0.251   TCP 66 43210→54310 [ACK] Seq=1183 Ack=124 Win=62 Len=0 TSval=1502943 TSecr=1502943
 70 9.000679000   10.0.0.253 -> 10.0.0.251   TCP 460 48178→54310 [PSH, ACK] Seq=1183 Ack=124 Win=62 Len=394 TSval=1503686 TSecr=1502936
 71 9.001039000   10.0.0.251 -> 10.0.0.253   TCP 107 54310→48178 [PSH, ACK] Seq=124 Ack=1577 Win=363 Len=41 TSval=1503686 TSecr=1503686
 72 9.001069000   10.0.0.253 -> 10.0.0.251   TCP 66 48178→54310 [ACK] Seq=1577 Ack=165 Win=62 Len=0 TSval=1503686 TSecr=1503686
 73 9.021274000   10.0.0.254 -> 10.0.0.251   TCP 460 50770→54310 [PSH, ACK] Seq=1608 Ack=157 Win=62 Len=394 TSval=1503691 TSecr=1502941
 74 9.021618000   10.0.0.251 -> 10.0.0.254   TCP 107 54310→50770 [PSH, ACK] Seq=157 Ack=2002 Win=363 Len=41 TSval=1503691 TSecr=1503691
 75 9.021642000   10.0.0.254 -> 10.0.0.251   TCP 66 50770→54310 [ACK] Seq=2002 Ack=198 Win=62 Len=0 TSval=1503691 TSecr=1503691
 76 9.029387000   10.0.0.252 -> 10.0.0.251   TCP 460 43210→54310 [PSH, ACK] Seq=1183 Ack=124 Win=62 Len=394 TSval=1503693 TSecr=1502943
 77 9.029616000   10.0.0.251 -> 10.0.0.252   TCP 107 54310→43210 [PSH, ACK] Seq=124 Ack=1577 Win=363 Len=41 TSval=1503693 TSecr=1503693
 78 9.029639000   10.0.0.252 -> 10.0.0.251   TCP 66 43210→54310 [ACK] Seq=1577 Ack=165 Win=62 Len=0 TSval=1503693 TSecr=1503693
